{
  "schema_version": "1.1",
  "rules_version": "R1-R15 / S151",
  "player": "Jaylen Brown",
  "group": "Wing",
  "position": "SG/SF",
  "career_status": "Active",
  "draft_class": null,
  "archetype": "Score-First Wing (no migration)",
  "evaluation_date": "2026-04-23",
  "composite_label": "Composite",
  "composite_score": 8.83,
  "tier": 5,
  "tier_label": "Perennial All-Star / legitimate star",
  "narrative": {
    "identity": "Jaylen Brown is a Score-First Wing in his 10th NBA season, a 7-time All-Star with a 2024 Finals MVP and championship to his name. At 6'6\", 223 lbs, with a 6'11.75\" wingspan, he combines elite wing strength with the length to defend across multiple positions. With Jayson Tatum out for most of 2025-26 recovering from injury, Brown has carried Boston's offensive load at a career-high level. He averaged 29.3 points per game at the All-Star break, up from 22.2 the prior year, and earned All-Star starter honors for the second straight year.",
    "strength": "Brown is a driver-first scorer. He gets to the rim 16.5 times per game, converting 52.8% from inside the arc on those drives, and finishes 68.3% at the basket on legitimate volume. His 13% dunk rate reflects real above-rim finishing for a wing his size. Off the bounce he is comfortable creating his own shot from mid-range (41.0% on 284 attempts) and the pull-up zone, and his playmaking has improved alongside the scoring expansion: 17.3% adjusted assist rate and 4.9 assists per game. Defensively he remains a functional wing stopper. He holds opponents 2.6% below their expected field-goal percentage, contests 4.5 shots a game, and his combination of strength and lateral quickness lets him switch from point guards to power forwards.",
    "weakness": "The perimeter shooting is the softest part of the profile. His catch-and-shoot 3-point conversion has dropped to 34.1%, well off the 38-39% peaks he held during the 2022-24 title-contending years, and his pull-up 3 sits at 32.9%. Ball security is a real cost of the higher usage. He turned the ball over 220 times in 71 games, with an assist-to-turnover ratio of 1.52 that is weak for a player operating as a primary handler. Defensively he is functional but not at an All-Defensive level. The team defense around him has slipped, and his individual ceiling on that end has settled at very-good rather than elite.",
    "projection_verdict": "Brown is a perennial All-Star whose level sits below the league's MVP candidates and above the back end of All-Star rotations. The ceiling is a first All-NBA selection and another deep playoff run, in the territory of Kawhi Leonard at his peak, if Tatum returns healthy and Boston's roster regenerates around the pair. The floor is an age-decline arc, where his shooting recovery never comes and his defensive role contracts. What he is, year over year, is a winning Score-First Wing with championship credentials and the physical tools to keep producing into his 30s. What he is not, and is unlikely to become, is the lead engine of an offense or an All-Defensive selection."
  },
  "domains": [
    {
      "id": 1,
      "name": "Finishing",
      "score": 8.7,
      "one_line": "8.7. Elite rim finishing on volume, with post game functional as a mismatch tool but not a primary option."
    },
    {
      "id": 2,
      "name": "Shooting",
      "score": 7.1,
      "one_line": "7.1. Three-level shooter showing a catch-and-shoot dip this season, with volume outpacing efficiency at the perimeter."
    },
    {
      "id": 3,
      "name": "Ball Skills",
      "score": 7.8,
      "one_line": "7.8. Strong handle and touch around the rim, but ball security at high usage is the real gap."
    },
    {
      "id": 4,
      "name": "Playmaking",
      "score": 7.2,
      "one_line": "7.2. Functional playmaking for a Score-First role, with decision-making the lever for any further ceiling."
    },
    {
      "id": 5,
      "name": "Defense",
      "score": 7.4,
      "one_line": "7.4. Functional wing stopper across positions, not at an All-Defensive level but well above liability."
    },
    {
      "id": 6,
      "name": "Rebounding",
      "score": 7.2,
      "one_line": "7.2. Physical wing rebounder on both glasses."
    },
    {
      "id": 7,
      "name": "Athleticism",
      "score": 8.5,
      "one_line": "8.5. Elite wing physicality combining first-step burst, strength, and lateral quickness."
    },
    {
      "id": 8,
      "name": "IQ / Motor",
      "score": 7.9,
      "one_line": "7.9. Finals MVP credential and high motor sit at the high end, while shot selection follows a Score-First volume profile rather than efficiency-first."
    }
  ],
  "sub_domains": [
    {
      "id": 1,
      "name": "At-basket finishing",
      "score": 8.5,
      "rationale_public": "Finishes 68.3% at the rim on 330 attempts and 52.8% on drives, with a 13% dunk rate.",
      "signature": {
        "name": "Rim Finisher",
        "tier": "Elite",
        "description": "Conversion at the basket through any means: rim finishes, touch finishes, floaters, fingerrolls, off-hand layups, and above-rim plays."
      }
    },
    {
      "id": 2,
      "name": "Contact finishing / foul draw",
      "score": 7.8,
      "rationale_public": "Draws 0.323 free throws per field-goal attempt and converts 78.6% from the line since 2024-25, with 0.657 points per drive possession.",
      "signature": null
    },
    {
      "id": 3,
      "name": "Post offense",
      "score": 6.5,
      "rationale_public": "Functional post-up against smaller defenders; usable as a mismatch tool, not a primary option.",
      "signature": null
    },
    {
      "id": 4,
      "name": "Catch-and-shoot 3PT",
      "score": 7.0,
      "rationale_public": "Catch-and-shoot 3-point at 34.1% on 386 attempts, with a 40.8% corner clip salvaging the dip.",
      "signature": null
    },
    {
      "id": 5,
      "name": "Off-dribble shooting",
      "score": 7.5,
      "rationale_public": "Pull-up 3 at 32.9% and pull-up mid-range 43.5% since 2024-25, with isolation creation in the 69th percentile.",
      "signature": null
    },
    {
      "id": 6,
      "name": "Mid-range",
      "score": 7.0,
      "rationale_public": "41.0% on 284 mid-range attempts; functional but not a weapon.",
      "signature": null
    },
    {
      "id": 7,
      "name": "Free throw",
      "score": 7.0,
      "rationale_public": "78.6% from the line on the season since 2024-25; clutch free throws drop to 68.2%.",
      "signature": null
    },
    {
      "id": 8,
      "name": "Handling / creation",
      "score": 7.8,
      "rationale_public": "Isolation 69th percentile, pick-and-roll handler 62.6th percentile, 16.5 drives per game at 52.8% since 2024-25.",
      "signature": null
    },
    {
      "id": 9,
      "name": "Touch / feel",
      "score": 7.5,
      "rationale_public": "Floater 45.5% on 442 attempts and 66.1% on non-dunk rim attempts; solid touch for a power wing.",
      "signature": null
    },
    {
      "id": 10,
      "name": "Ball security",
      "score": 5.9,
      "rationale_public": "Assist-to-turnover ratio 1.52 and 220 turnovers in 71 games; a real gap for a primary handler.",
      "signature": null
    },
    {
      "id": 11,
      "name": "Court vision",
      "score": 7.0,
      "rationale_public": "17.3% adjusted assist rate since 2024-25 and 8.9 potential assists per game; solid vision, not weapons-grade.",
      "signature": null
    },
    {
      "id": 12,
      "name": "Decision-making",
      "score": 7.4,
      "rationale_public": "Plays at a championship level when healthy with positive clutch impact across 52 games; turnover rate at high usage is the cost.",
      "signature": null
    },
    {
      "id": 13,
      "name": "Passing execution",
      "score": 7.0,
      "rationale_public": "Assists convert at 54.6% since 2024-25; adequate delivery for the role.",
      "signature": null
    },
    {
      "id": 14,
      "name": "Off-ball movement",
      "score": 7.0,
      "rationale_public": "1.146 points per possession on cuts and 1.131 in transition; functional off-ball mover.",
      "signature": null
    },
    {
      "id": 15,
      "name": "On-ball pressure",
      "score": 7.5,
      "rationale_public": "Suppresses opponent field-goal percentage by 2.6% versus expected since 2024-25, contesting 4.5 shots per game; functional wing stopper.",
      "signature": null
    },
    {
      "id": 16,
      "name": "Help defense",
      "score": 7.0,
      "rationale_public": "1.8 deflections per game; adequate help defense in a weakened team scheme.",
      "signature": null
    },
    {
      "id": 17,
      "name": "Rim protection",
      "score": 3.5,
      "rationale_public": "Wing baseline rim protection.",
      "signature": null
    },
    {
      "id": 18,
      "name": "Post defense",
      "score": 5.0,
      "rationale_public": "Holds post-ups to 1.044 points per possession; competent for a wing.",
      "signature": null
    },
    {
      "id": 19,
      "name": "Offensive rebounding",
      "score": 6.5,
      "rationale_public": "Offensive rebound rate 3.4% since 2024-25 and 1.18 per game; above-average wing crashing.",
      "signature": null
    },
    {
      "id": 20,
      "name": "Defensive rebounding",
      "score": 7.5,
      "rationale_public": "Defensive rebound rate 14.3% since 2024-25 and 5.28 per game; strong for a wing.",
      "signature": null
    },
    {
      "id": 21,
      "name": "Burst / explosion",
      "score": 8.3,
      "rationale_public": "16.5 drives per game at 52.8%, 13% dunk rate since 2024-25, 1.131 points per transition possession.",
      "signature": {
        "name": "Athlete",
        "tier": "Proven",
        "description": "Burst and lateral quickness as one athletic profile. First-step explosion, vertical leap, hip mobility, and change of direction in space."
      }
    },
    {
      "id": 22,
      "name": "Lateral quickness",